<?xml version="1.0" encoding="UTF-8"?>
<experiment xmlns:xsi="http://www.w3.org/2001/XMLSchema-instance"
 xsi:noNamespaceSchemaLocation="schema.xsd">
    <stimulus-response-pair>
        <auditory-loop-priority>3</auditory-loop-priority>
        <pair>F E P : H A J</pair>
    </stimulus-response-pair>
    <stimulus-response-pair>
        <auditory-loop-priority>2</auditory-loop-priority>
        <pair>Z U X : M A F</pair>
    </stimulus-response-pair>
    <stimulus-response-pair>
        <auditory-loop-priority>1</auditory-loop-priority>
        <pair>P I J : Y U F</pair>
    </stimulus-response-pair>
    <fast-presentation>
        <percentage-correct>
            <percentage-correct-data>0.5</percentage-correct-data>
            <percentage-correct-data>1.0</percentage-correct-data>
            <percentage-correct-data>1.5</percentage-correct-data>
            <percentage-correct-data>2.8</percentage-correct-data>
            <percentage-correct-data>3.3</percentage-correct-data>
            <percentage-correct-data>3.7</percentage-correct-data>
            <percentage-correct-data>3.75</percentage-correct-data>
            <percentage-correct-data>4.3</percentage-correct-data>
            <percentage-correct-data>5.0</percentage-correct-data>
            <percentage-correct-data>5.5</percentage-correct-data>
        </percentage-correct>
        <cumulative-errors>
            <cumulative-errors-data>
                <pair>F E P : H A J</pair>
                <cumulative-error>5</cumulative-error>
            </cumulative-errors-data>
            <cumulative-errors-data>
                <pair>Z U X : M A F</pair>
                <cumulative-error>6</cumulative-error>
            </cumulative-errors-data>
            <cumulative-errors-data>
                <pair>P I J : Y U F</pair>
                <cumulative-error>7</cumulative-error>
            </cumulative-errors-data>
        </cumulative-errors>
    </fast-presentation>
    <slow-presentation>
        <percentage-correct>
            <percentage-correct-data>0.6</percentage-correct-data>
            <percentage-correct-data>1.4</percentage-correct-data>
            <percentage-correct-data>2.8</percentage-correct-data>
            <percentage-correct-data>3.7</percentage-correct-data>
            <percentage-correct-data>4.5</percentage-correct-data>
            <percentage-correct-data>5.0</percentage-correct-data>
            <percentage-correct-data>5.6</percentage-correct-data>
            <percentage-correct-data>6.6</percentage-correct-data>
            <percentage-correct-data>6.65</percentage-correct-data>
            <percentage-correct-data>7.4</percentage-correct-data>
        </percentage-correct>
        <cumulative-errors>
            <cumulative-errors-data>
                <pair>F E P : H A J</pair>
                <cumulative-error>4</cumulative-error>
            </cumulative-errors-data>
            <cumulative-errors-data>
                <pair>Z U X : M A F</pair>
                <cumulative-error>3</cumulative-error>
            </cumulative-errors-data>
            <cumulative-errors-data>
                <pair>P I J : Y U F</pair>
                <cumulative-error>6</cumulative-error>
            </cumulative-errors-data>
        </cumulative-errors>
    </slow-presentation>
</experiment>